{"schema": 1, "title_key": "cyberblock.afterlife.shop.gear", "restock": 1200, "stock": [{"item": "minecraft:torch", "count": 16, "price": 8, "limit": 8}, {"item": "minecraft:ladder", "count": 8, "price": 12, "limit": 6}, {"item": "minecraft:water_bucket", "count": 1, "price": 25, "limit": 4}, {"item": "minecraft:iron_pickaxe", "count": 1, "price": 80, "limit": 3}, {"item": "minecraft:compass", "count": 1, "price": 30, "limit": 4}, {"item": "minecraft:clock", "count": 1, "price": 30, "limit": 4}, {"item": "minecraft:ender_pearl", "count": 1, "price": 70, "limit": 4}, {"item": "minecraft:firework_rocket", "count": 8, "price": 60, "limit": 4}, {"item": "minecraft:golden_apple", "count": 1, "price": 140, "limit": 3}, {"item": "minecraft:cooked_beef", "count": 4, "price": 16, "limit": 8}, {"item": "minecraft:leather_boots", "count": 1, "price": 20, "limit": 4}, {"item": "minecraft:bucket", "count": 1, "price": 15, "limit": 4}], "sell": [{"item": "minecraft:compass", "count": 1, "price": 10}, {"item": "minecraft:clock", "count": 1, "price": 10}, {"item": "minecraft:torch", "count": 16, "price": 2}]}
