{"schema": 1, "title_key": "cyberblock.shop.vending_gear", "restock": 1800, "stock": [{"item": "minecraft:torch", "count": 16, "price": 8, "limit": 8}, {"item": "minecraft:arrow", "count": 16, "price": 18, "limit": 8}, {"item": "minecraft:redstone", "count": 8, "price": 15, "limit": 8}, {"item": "minecraft:ender_pearl", "count": 1, "price": 70, "limit": 2}, {"item": "cyberblock:ram_shard", "count": 1, "price": 150, "limit": 2}]}
